{
  "unit_id": "research-methods",
  "version": "0.1.3",
  "teacher_review": {
    "status": "PENDING",
    "reviewer": null
  },
  "sources": [
    {
      "source_id": "openstax-psychology2e-2-3",
      "url": "https://openstax.org/books/psychology-2e/pages/2-3-analyzing-findings",
      "title": "Psychology 2e, 2.3 Analyzing Findings",
      "verification_status": "PENDING",
      "snapshot_sha256": "b5657827125dcca0802f9a0031d99e0a9fffe9bb7ddd3878ac68387402f3c3d5",
      "license": "CC-BY-4.0",
      "version_url": "https://raw.githubusercontent.com/openstax/osbooks-psychology/e061043bf2f9e86ace51c4e8dc9555160f60a99d/modules/m82169/index.cnxml",
      "attribution": "OpenStax, Rice University. Access for free at openstax.org."
    },
    {
      "source_id": "kim-thoemmes-2026-mediation",
      "url": "https://doi.org/10.1525/collabra.171584",
      "title": "A Systematic Literature Review of Causal Mediation Analysis in Social Psychology",
      "verification_status": "PENDING",
      "snapshot_sha256": "e279b4a67ff3e712283f179e7f728b979800af6f6b1729c6da823e7305d93918",
      "license": "CC-BY-4.0",
      "attribution": "Jiwoo Kim and Felix Thoemmes (2026), Collabra: Psychology 12(1), 171584, https://doi.org/10.1525/collabra.171584"
    }
  ],
  "concepts": [
    {
      "concept_id": "operational-definition",
      "version": "0.1.0",
      "terms": {
        "zh-CN": {
          "full": "操作性定义",
          "review_status": "PENDING"
        },
        "en": {
          "full": "Operational definition",
          "review_status": "PENDING"
        },
        "ja": {
          "full": "操作的定義",
          "review_status": "PENDING"
        },
        "ko": {
          "full": "조작적 정의",
          "review_status": "PENDING"
        }
      },
      "definition": "对研究变量如何被测量或操作作出具体、可检验的描述。",
      "source_refs": [
        "openstax-psychology2e-2-3"
      ],
      "misconceptions": [
        {
          "misconception_id": "operational-definition-1",
          "text": "把抽象标签当作已能测量的操作性定义。",
          "basis": "model_hypothesis",
          "remediation": "明确可观察指标、测量场景、时间窗口和计分规则。",
          "retest_goal": "在新情境中说明结论及其边界。"
        },
        {
          "misconception_id": "operational-definition-2",
          "text": "认为只给变量起名就可以重复测量。",
          "basis": "model_hypothesis",
          "remediation": "说明由谁、在何时、如何记录与计分，使他人能够复现。",
          "retest_goal": "辨别概念并说明具体判断依据。"
        }
      ],
      "evidence_anchor": {
        "source_ref": "openstax-psychology2e-2-3",
        "start_char": 12152,
        "end_char": 13023,
        "text": "We also need to precisely define, or operationalize, how we measure learning of algebra. An operational definition is a precise description of our variables, and it is important in allowing others to understand exactly how and what a researcher measures in a particular experiment. In operationalizing learning, we might choose to look at performance on a test covering the material on which the individuals were taught by the teacher or the computer program. We might also ask our participants to summarize the information that was just presented in some way. Whatever we determine, it is important that we operationalize learning in such a way that anyone who hears about our study for the first time knows exactly what we mean by learning. This aids peoples’ ability to interpret our data as well as their capacity to repeat our experiment should they choose to do so.",
        "verification_status": "LOCATED_ONLY"
      },
      "prerequisites": [],
      "boundary": "研究设计、样本来源和测量限制决定推断范围；单个实例不证明普遍因果关系。",
      "examples": {
        "positive": {
          "text": "虚构研究把睡眠时长定义为连续七天佩戴设备记录的每夜睡眠分钟数。",
          "fictional": true
        },
        "counterexample": {
          "text": "仅将课堂参与定义为“积极”，没有可观察指标、计数方式和时间范围。",
          "fictional": true
        }
      },
      "content_review_status": "PENDING"
    },
    {
      "concept_id": "correlation",
      "version": "0.1.0",
      "terms": {
        "zh-CN": {
          "full": "相关",
          "review_status": "PENDING"
        },
        "en": {
          "full": "Correlation",
          "review_status": "PENDING"
        },
        "ja": {
          "full": "相関",
          "review_status": "PENDING"
        },
        "ko": {
          "full": "상관관계",
          "review_status": "PENDING"
        }
      },
      "definition": "两个或多个变量之间的统计关联；这种关联本身不能单独确立因果关系，也不能确定因果方向。",
      "source_refs": [
        "openstax-psychology2e-2-3"
      ],
      "misconceptions": [
        {
          "misconception_id": "correlation-1",
          "text": "认为相关足以证明一个变量导致另一个变量。",
          "basis": "model_hypothesis",
          "remediation": "区分统计关联和因果关系，考虑反向因果与共同影响因素。",
          "retest_goal": "在新情境中说明结论及其边界。"
        },
        {
          "misconception_id": "correlation-2",
          "text": "认为只要存在相关就不可能有其他解释。",
          "basis": "model_hypothesis",
          "remediation": "相关可以由共同因素、反向因果或其他机制产生，应根据设计进一步判断。",
          "retest_goal": "辨别概念并说明具体判断依据。"
        }
      ],
      "evidence_anchor": {
        "source_ref": "openstax-psychology2e-2-3",
        "start_char": 1118,
        "end_char": 1695,
        "text": "Correlation means that there is a relationship between two or more variables (such as ice cream consumption and crime), but this relationship does not necessarily imply cause and effect. When two variables are correlated, it simply means that as one variable changes, so does the other. We can measure correlation by calculating a statistic known as a correlation coefficient. A correlation coefficient is a number from -1 to +1 that indicates the strength and direction of the relationship between variables. The correlation coefficient is usually represented by the letter r.",
        "verification_status": "LOCATED_ONLY"
      },
      "prerequisites": [],
      "boundary": "研究设计、样本来源和测量限制决定推断范围；单个实例不证明普遍因果关系。",
      "examples": {
        "positive": {
          "text": "虚构调查发现学习时间与成绩之间存在关联，但没有操纵学习时间或控制其他差异。",
          "fictional": true
        },
        "counterexample": {
          "text": "相关一定意味着学习时间导致成绩变化",
          "fictional": true
        }
      },
      "content_review_status": "PENDING"
    },
    {
      "concept_id": "random-assignment",
      "version": "0.1.0",
      "terms": {
        "zh-CN": {
          "full": "随机分配",
          "review_status": "PENDING"
        },
        "en": {
          "full": "Random assignment",
          "review_status": "PENDING"
        },
        "ja": {
          "full": "ランダム割り当て",
          "review_status": "PENDING"
        },
        "ko": {
          "full": "무선 할당",
          "review_status": "PENDING"
        }
      },
      "definition": "使用预先确定的随机机制，将已纳入的参与者分配到研究条件；各组分配概率可按设计相同或不同。",
      "source_refs": [
        "openstax-psychology2e-2-3"
      ],
      "misconceptions": [
        {
          "misconception_id": "random-assignment-1",
          "text": "把随机分配已招募参与者误认为从目标人群随机抽样。",
          "basis": "model_hypothesis",
          "remediation": "随机抽样决定谁进入样本，随机分配决定样本中谁进入哪组；前者涉及代表性。",
          "retest_goal": "在新情境中说明结论及其边界。"
        },
        {
          "misconception_id": "random-assignment-2",
          "text": "认为随机分配保证各组所有特征完全相同。",
          "basis": "model_hypothesis",
          "remediation": "随机分配降低系统性分配偏差，但有限样本可能仍存在组间差异。",
          "retest_goal": "辨别概念并说明具体判断依据。"
        }
      ],
      "evidence_anchor": {
        "source_ref": "openstax-psychology2e-2-3",
        "start_char": 20439,
        "end_char": 20845,
        "text": "Now that we have a sample, the next step of the experimental process is to split the participants into experimental and control groups through random assignment. With random assignment, all participants have an equal chance of being assigned to either group. There is statistical software that will randomly assign each of the algebra students in the sample to either the experimental or the control group.",
        "verification_status": "LOCATED_ONLY"
      },
      "prerequisites": [],
      "boundary": "随机分配不等于从目标人群随机抽样，也不保证有限样本各组特征完全相同；本教材介绍等概率分配示例。",
      "examples": {
        "positive": {
          "text": "虚构实验将已经招募的参与者通过随机机制分配到两种教学条件。",
          "fictional": true
        },
        "counterexample": {
          "text": "随机分配保证样本代表所有人群",
          "fictional": true
        }
      },
      "content_review_status": "PENDING"
    },
    {
      "concept_id": "confounding-variable",
      "version": "0.1.0",
      "terms": {
        "zh-CN": {
          "full": "混淆变量",
          "review_status": "PENDING"
        },
        "en": {
          "full": "Confounding variable",
          "review_status": "PENDING"
        },
        "ja": {
          "full": "交絡変数",
          "review_status": "PENDING"
        },
        "ko": {
          "full": "교란변인",
          "review_status": "PENDING"
        }
      },
      "definition": "在本课的暴露—结果框架中，可能先于暴露并同时影响暴露与结果的共同原因；仅凭与两者相关不能确认其角色。",
      "source_refs": [
        "openstax-psychology2e-2-3"
      ],
      "misconceptions": [
        {
          "misconception_id": "confounding-variable-1",
          "text": "认为观察到关联就证明研究变量直接导致结果。",
          "basis": "model_hypothesis",
          "remediation": "检查可能同时影响暴露与结果的其他变量；关联本身不能单独确立因果。",
          "retest_goal": "在新情境中说明结论及其边界。"
        },
        {
          "misconception_id": "confounding-variable-2",
          "text": "认为发现可能的混淆因素就证明原变量绝无作用。",
          "basis": "model_hypothesis",
          "remediation": "可能的混淆因素提供替代解释；它不能单独证明原变量没有作用，需要进一步研究或控制。",
          "retest_goal": "辨别概念并说明具体判断依据。"
        }
      ],
      "evidence_anchor": {
        "source_ref": "openstax-psychology2e-2-3",
        "start_char": 4741,
        "end_char": 5383,